{
  "schema_version": "1.0",
  "review_id": "2026-Q3-baseline",
  "as_of_date": "2026-09-01",
  "baseline": true,
  "metric": "FY2025 net sales attributable to prescription medicines and vaccines",
  "currency": "USD",
  "units": "billions",
  "projection_year": 2030,
  "ranking": [
    {"rank": 1, "company": "Eli Lilly", "sales": 65.179, "projected_rank_range": [1, 1], "projected_sales_range": [112, 130], "midpoint_rank": 1, "crm": "transitioning_to_veeva_vault_crm", "crm_scope": "global"},
    {"rank": 2, "company": "Pfizer", "sales": 62.580, "projected_rank_range": [9, 12], "projected_sales_range": [52, 62], "midpoint_rank": 10, "crm": "transitioning_to_salesforce", "crm_scope": "not_public"},
    {"rank": 3, "company": "Johnson & Johnson Innovative Medicine", "sales": 60.401, "projected_rank_range": [4, 7], "projected_sales_range": [67, 78], "midpoint_rank": 5, "crm": "not_public", "crm_scope": "not_public"},
    {"rank": 4, "company": "AstraZeneca", "sales": 58.739, "projected_rank_range": [2, 5], "projected_sales_range": [72, 82], "midpoint_rank": 3, "crm": "transitioning_to_salesforce", "crm_scope": "global"},
    {"rank": 5, "company": "Merck & Co. / MSD", "sales": 58.142, "projected_rank_range": [7, 10], "projected_sales_range": [58, 68], "midpoint_rank": 8, "crm": "transitioning_to_veeva_vault_crm", "crm_scope": "not_public"},
    {"rank": 6, "company": "Roche Pharmaceuticals", "sales": 57.490, "reported_sales": 47.669, "reported_currency": "CHF", "projected_rank_range": [5, 8], "projected_sales_range": [66, 74], "midpoint_rank": 6, "crm": "transitioning_to_veeva_vault_crm", "crm_scope": "global_pharma"},
    {"rank": 7, "company": "AbbVie", "sales": 56.300, "projected_rank_range": [2, 5], "projected_sales_range": [72, 82], "midpoint_rank": 4, "crm": "transitioning_to_salesforce", "crm_scope": "not_public"},
    {"rank": 8, "company": "Novartis", "sales": 54.532, "projected_rank_range": [7, 10], "projected_sales_range": [55, 66], "midpoint_rank": 9, "crm": "transitioning_to_salesforce", "crm_scope": "global_five_year_rollout"},
    {"rank": 9, "company": "Sanofi", "sales": 49.297, "reported_sales": 43.626, "reported_currency": "EUR", "projected_rank_range": [5, 8], "projected_sales_range": [65, 74], "midpoint_rank": 7, "crm": "not_public", "crm_scope": "not_public"},
    {"rank": 10, "company": "Bristol Myers Squibb", "sales": 48.194, "projected_rank_range": [10, 13], "projected_sales_range": [44, 54], "midpoint_rank": 12, "crm": "transitioning_to_veeva_vault_crm", "crm_scope": "not_public"},
    {"rank": 11, "company": "Novo Nordisk", "sales": 46.800, "reported_sales": 309.064, "reported_currency": "DKK", "projected_rank_range": [2, 4], "projected_sales_range": [72, 88], "midpoint_rank": 2, "crm": "veeva_vault_crm", "crm_scope": "international_operations_only"},
    {"rank": 12, "company": "GSK", "sales": 43.080, "reported_sales": 32.667, "reported_currency": "GBP", "projected_rank_range": [10, 13], "projected_sales_range": [47, 55], "midpoint_rank": 11, "crm": "transitioning_to_veeva_vault_crm", "crm_scope": "global_rollout_announced"},
    {"rank": 13, "company": "Amgen", "sales": 36.800, "projected_rank_range": [11, 14], "projected_sales_range": [43, 53], "midpoint_rank": 13, "crm": "not_public", "crm_scope": "not_public"},
    {"rank": 14, "company": "Takeda", "sales": 30.100, "reported_sales": 4505.7, "reported_currency": "JPY", "fiscal_year_end": "2026-03-31", "crm": "salesforce_life_sciences_cloud", "crm_scope": "not_public"},
    {"rank": 15, "company": "Boehringer Ingelheim Human Pharma", "sales": 25.687, "reported_sales": 22.733, "reported_currency": "EUR", "crm": "mixed_or_scope_specific", "crm_scope": "conflicting_functional_evidence"}
  ],
  "fx_annual_average_2025": {"EURUSD": 1.1300, "EURCHF": 0.9370, "EURGBP": 0.85687, "EURDKK": 7.4634, "EURJPY": 169.07},
  "exclusions": {"Johnson & Johnson": "MedTech", "Roche": "Diagnostics", "Merck & Co.": "Animal Health", "AbbVie": "Aesthetics"},
  "notes": [
    "AstraZeneca, Merck and BMS include pharma-related alliance or royalty revenue where reported within the pharmaceutical business.",
    "AbbVie sales are analytically adjusted by subtracting Aesthetics from total net revenue.",
    "Projected ranks and sales are own ranges, not point forecasts.",
    "CRM classifications require explicit public evidence and do not infer global scope from isolated deployments."
  ]
}
